{
  "content_address": {
    "hash_algorithm": "sha256",
    "inputs": [
      {
        "path": "05_script_draft.md",
        "sha256": "d8e524a3496a486d919ca96f5b550f4c8644520a54cfdc676362a7eaf6a00814"
      },
      {
        "path": "05_blind_knowledge_inventory.json",
        "sha256": "0dc9b5b9d2db3bdf7f2a103df095768a0243f618df1ea62deaf0efb555f8c470"
      }
    ]
  },
  "candidate_conservation_proof": {
    "discovered_candidate_ids": [
      "F001",
      "F002",
      "F003",
      "F004",
      "F005"
    ],
    "dispositions": {
      "F001": {
        "status": "GROUNDED",
        "exact_phrase": "알리이나아제",
        "grounding_sentence_id": "S0013"
      },
      "F002": {
        "status": "GROUNDED",
        "exact_phrase": "눈물 유발 인자 합성효소",
        "grounding_sentence_id": "S0027"
      },
      "F003": {
        "status": "GROUNDED",
        "exact_phrase": "syn-propanethial S-oxide",
        "grounding_sentence_id": "S0035"
      },
      "F004": {
        "status": "GROUNDED",
        "exact_phrase": "반사 눈물",
        "grounding_sentence_id": "S0012"
      },
      "F005": {
        "status": "GROUNDED",
        "exact_phrase": "설펜산",
        "grounding_sentence_id": "S0019"
      }
    },
    "discovered_count": 5,
    "baseline_known_count": 0,
    "grounded_count": 5,
    "replaced_count": 0,
    "removed_count": 0,
    "unresolved_count": 0,
    "equation_valid": true,
    "missing_candidate_ids": [],
    "duplicate_disposition_ids": []
  },
  "temporal_proofs": [
    {
      "candidate_id": "F001",
      "first_use_sentence_id": "S0013",
      "grounding_mode": "INLINE",
      "grounding_sentence_id": "S0013",
      "ordering_valid": true
    },
    {
      "candidate_id": "F002",
      "first_use_sentence_id": "S0027",
      "grounding_mode": "INLINE",
      "grounding_sentence_id": "S0027",
      "ordering_valid": true
    },
    {
      "candidate_id": "F003",
      "first_use_sentence_id": "S0035",
      "grounding_mode": "INLINE",
      "grounding_sentence_id": "S0035",
      "ordering_valid": true
    },
    {
      "candidate_id": "F004",
      "first_use_sentence_id": "S0012",
      "grounding_mode": "INLINE",
      "grounding_sentence_id": "S0012",
      "ordering_valid": true
    },
    {
      "candidate_id": "F005",
      "first_use_sentence_id": "S0019",
      "grounding_mode": "INLINE",
      "grounding_sentence_id": "S0019",
      "ordering_valid": true
    }
  ],
  "status": "PASS"
}
