{
  "content_address": {
    "hash_algorithm": "sha256",
    "inputs": [
      {
        "path": "05_script_draft.md",
        "sha256": "70d1cf648ee3b19699fe26b49ed10d73d6341adf86b624f21c10b0bf686c4635"
      },
      {
        "path": "05_blind_knowledge_inventory.json",
        "sha256": "b1b858a65473c0894677528375131d2130574bb1534cf38ea012d1736ffff4e0"
      }
    ]
  },
  "candidate_conservation_proof": {
    "discovered_candidate_ids": [
      "F001",
      "F002",
      "F003",
      "F004",
      "F005"
    ],
    "dispositions": {
      "F001": {
        "status": "GROUNDED",
        "exact_phrase": "Alliinase",
        "grounding_sentence_id": "S0013"
      },
      "F002": {
        "status": "GROUNDED",
        "exact_phrase": "Tränenfaktor-Synthase",
        "grounding_sentence_id": "S0028"
      },
      "F003": {
        "status": "GROUNDED",
        "exact_phrase": "syn-Propanthial-S-oxid",
        "grounding_sentence_id": "S0036"
      },
      "F004": {
        "status": "GROUNDED",
        "exact_phrase": "Reflextränen",
        "grounding_sentence_id": "S0012"
      },
      "F005": {
        "status": "GROUNDED",
        "exact_phrase": "Sulfensäuren",
        "grounding_sentence_id": "S0020"
      }
    },
    "discovered_count": 5,
    "baseline_known_count": 0,
    "grounded_count": 5,
    "replaced_count": 0,
    "removed_count": 0,
    "unresolved_count": 0,
    "equation_valid": true,
    "missing_candidate_ids": [],
    "duplicate_disposition_ids": []
  },
  "temporal_proofs": [
    {
      "candidate_id": "F001",
      "first_use_sentence_id": "S0013",
      "grounding_mode": "INLINE",
      "grounding_sentence_id": "S0013",
      "ordering_valid": true
    },
    {
      "candidate_id": "F002",
      "first_use_sentence_id": "S0028",
      "grounding_mode": "INLINE",
      "grounding_sentence_id": "S0028",
      "ordering_valid": true
    },
    {
      "candidate_id": "F003",
      "first_use_sentence_id": "S0036",
      "grounding_mode": "INLINE",
      "grounding_sentence_id": "S0036",
      "ordering_valid": true
    },
    {
      "candidate_id": "F004",
      "first_use_sentence_id": "S0012",
      "grounding_mode": "INLINE",
      "grounding_sentence_id": "S0012",
      "ordering_valid": true
    },
    {
      "candidate_id": "F005",
      "first_use_sentence_id": "S0020",
      "grounding_mode": "INLINE",
      "grounding_sentence_id": "S0020",
      "ordering_valid": true
    }
  ],
  "status": "PASS"
}
