{
  "content_address": {
    "hash_algorithm": "sha256",
    "inputs": [
      {
        "path": "05_script_draft.md",
        "sha256": "1922126eac6f6904ff3382128cabfdd804b546b4a93e13718765a831b1ef1687"
      },
      {
        "path": "05_blind_knowledge_inventory.json",
        "sha256": "1ebf205f279dbbae6bb1f90862b94096352210dd738b8d866070bd64ff41968c"
      }
    ]
  },
  "candidate_conservation_proof": {
    "discovered_candidate_ids": [
      "F001",
      "F002",
      "F003",
      "F004"
    ],
    "dispositions": {
      "F001": {
        "status": "GROUNDED",
        "exact_phrase": "alliinase",
        "grounding_sentence_id": "S0012"
      },
      "F002": {
        "status": "GROUNDED",
        "exact_phrase": "lachrymatory-factor synthase",
        "grounding_sentence_id": "S0026"
      },
      "F003": {
        "status": "GROUNDED",
        "exact_phrase": "syn-propanethial S-oxide",
        "grounding_sentence_id": "S0033"
      },
      "F004": {
        "status": "GROUNDED",
        "exact_phrase": "reflex tears",
        "grounding_sentence_id": "S0039"
      }
    },
    "discovered_count": 4,
    "baseline_known_count": 0,
    "grounded_count": 4,
    "replaced_count": 0,
    "removed_count": 0,
    "unresolved_count": 0,
    "equation_valid": true,
    "missing_candidate_ids": [],
    "duplicate_disposition_ids": []
  },
  "temporal_proofs": [
    {
      "candidate_id": "F001",
      "first_use_sentence_id": "S0012",
      "grounding_mode": "INLINE",
      "grounding_sentence_id": "S0012",
      "ordering_valid": true
    },
    {
      "candidate_id": "F002",
      "first_use_sentence_id": "S0026",
      "grounding_mode": "INLINE",
      "grounding_sentence_id": "S0026",
      "ordering_valid": true
    },
    {
      "candidate_id": "F003",
      "first_use_sentence_id": "S0033",
      "grounding_mode": "INLINE",
      "grounding_sentence_id": "S0033",
      "ordering_valid": true
    },
    {
      "candidate_id": "F004",
      "first_use_sentence_id": "S0039",
      "grounding_mode": "INLINE",
      "grounding_sentence_id": "S0039",
      "ordering_valid": true
    }
  ],
  "status": "PASS"
}
