{
  "content_address": {
    "hash_algorithm": "sha256",
    "inputs": [
      {
        "path": "05_script_draft.md",
        "sha256": "b107f65ca4e699d3cd73e44a77ed220e552226e4464f9083580a13ff8d05f9e8"
      },
      {
        "path": "05_blind_knowledge_inventory.json",
        "sha256": "67ca419918d10dd6ca846f33aee0159b725c0305e9ed20622687076c5901a63d"
      }
    ]
  },
  "candidate_conservation_proof": {
    "discovered_candidate_ids": [
      "F001",
      "F002",
      "F003",
      "F004",
      "F005"
    ],
    "dispositions": {
      "F001": {
        "status": "GROUNDED",
        "exact_phrase": "aliinasa",
        "grounding_sentence_id": "S0013"
      },
      "F002": {
        "status": "GROUNDED",
        "exact_phrase": "sintasa del factor lacrimógeno",
        "grounding_sentence_id": "S0028"
      },
      "F003": {
        "status": "GROUNDED",
        "exact_phrase": "syn-propanetial-S-óxido",
        "grounding_sentence_id": "S0036"
      },
      "F004": {
        "status": "GROUNDED",
        "exact_phrase": "lágrimas reflejas",
        "grounding_sentence_id": "S0012"
      },
      "F005": {
        "status": "GROUNDED",
        "exact_phrase": "ácidos sulfénicos",
        "grounding_sentence_id": "S0020"
      }
    },
    "discovered_count": 5,
    "baseline_known_count": 0,
    "grounded_count": 5,
    "replaced_count": 0,
    "removed_count": 0,
    "unresolved_count": 0,
    "equation_valid": true,
    "missing_candidate_ids": [],
    "duplicate_disposition_ids": []
  },
  "temporal_proofs": [
    {
      "candidate_id": "F001",
      "first_use_sentence_id": "S0013",
      "grounding_mode": "INLINE",
      "grounding_sentence_id": "S0013",
      "ordering_valid": true
    },
    {
      "candidate_id": "F002",
      "first_use_sentence_id": "S0028",
      "grounding_mode": "INLINE",
      "grounding_sentence_id": "S0028",
      "ordering_valid": true
    },
    {
      "candidate_id": "F003",
      "first_use_sentence_id": "S0036",
      "grounding_mode": "INLINE",
      "grounding_sentence_id": "S0036",
      "ordering_valid": true
    },
    {
      "candidate_id": "F004",
      "first_use_sentence_id": "S0012",
      "grounding_mode": "INLINE",
      "grounding_sentence_id": "S0012",
      "ordering_valid": true
    },
    {
      "candidate_id": "F005",
      "first_use_sentence_id": "S0020",
      "grounding_mode": "INLINE",
      "grounding_sentence_id": "S0020",
      "ordering_valid": true
    }
  ],
  "status": "PASS"
}
